[
  { "context_a": "CTX-0001", "context_b": "CTX-0002", "pattern": "customer-supplier", "upstream": "CTX-0001",
    "rationale": "Billing reacts to order.created; Ordering does not adjust for Billing's needs today, but could accommodate them",
    "evidence": [ { "source": "code", "locator": "services/orders-svc/app.py:20" } ] }
]
